<?xml version="1.0" encoding="UTF-8"?>
<!ELEMENT students (student+)>
<!ELEMENT student (roll,name,dep)>
<!ELEMENT roll (#PCDATA)>
<!ELEMENT name (#PCDATA)>
<!ELEMENT dep (#PCDATA)>
<!ATTLIST student id CDATA #REQUIRED>