<?xml version="1.0"?>
<!DOCTYPE students SYSTEM "students.dtd">
<students>
    <student id="1">
        <roll>19131A1204</roll>
        <name>Surya</name>
        <dep>IT</dep>
    </student>
    <student id="2">
        <roll>19131A1204</roll>
        <name>Chandra</name>
        <dep>IT</dep>
    </student>
    <student id="3">
        <roll>19131A1204</roll>
        <name>Pavan</name>
        <dep>IT</dep>
    </student>
</students>